{
 "version": 1,
 "task": {
  "task_id": "b6-jfk-20230626-1400",
  "carrier": "B6",
  "hub": "JFK",
  "date": "2023-06-26",
  "tz": "America/New_York",
  "window": [
   840,
   1200
  ],
  "start": 780,
  "turn": {
   "A32X": 49,
   "A220": 47,
   "E190": 37
  },
  "turn_all": 41,
  "dmax": 360,
  "airports": {
   "BNA": {
    "name": "Nashville International Airport",
    "lat": 36.124475,
    "lon": -86.678181,
    "tz": "America/Chicago"
   },
   "BOS": {
    "name": "General Edward Lawrence Logan International Airport",
    "lat": 42.362944,
    "lon": -71.006389,
    "tz": "America/New_York"
   },
   "CHS": {
    "name": "Charleston Afb/International Airport",
    "lat": 32.898639,
    "lon": -80.040528,
    "tz": "America/New_York"
   },
   "DCA": {
    "name": "Ronald Reagan Washington Ntl Airport",
    "lat": 38.85144,
    "lon": -77.037721,
    "tz": "America/New_York"
   },
   "HYA": {
    "name": "Cape Cod Gateway Airport",
    "lat": 41.669337,
    "lon": -70.280359,
    "tz": "America/New_York"
   },
   "IAH": {
    "name": "George Bush Intcntl/Houston Airport",
    "lat": 29.984435,
    "lon": -95.341442,
    "tz": "America/Chicago"
   },
   "JFK": {
    "name": "John F Kennedy International Airport",
    "lat": 40.639928,
    "lon": -73.778692,
    "tz": "America/New_York"
   },
   "LGA": {
    "name": "Laguardia Airport",
    "lat": 40.777242,
    "lon": -73.872606,
    "tz": "America/New_York"
   },
   "MCO": {
    "name": "Orlando International Airport",
    "lat": 28.429394,
    "lon": -81.308993,
    "tz": "America/New_York"
   },
   "PBI": {
    "name": "President Donald J Trump International Airport",
    "lat": 26.683162,
    "lon": -80.095592,
    "tz": "America/New_York"
   },
   "PDX": {
    "name": "Portland International Airport",
    "lat": 45.588709,
    "lon": -122.596869,
    "tz": "America/Los_Angeles"
   },
   "RDU": {
    "name": "Raleigh-Durham International Airport",
    "lat": 35.877639,
    "lon": -78.787472,
    "tz": "America/New_York"
   },
   "RNO": {
    "name": "Reno/Tahoe International Airport",
    "lat": 39.499111,
    "lon": -119.768111,
    "tz": "America/Los_Angeles"
   },
   "ROC": {
    "name": "Frederick Douglass/Greater Rochester International Airport",
    "lat": 43.119144,
    "lon": -77.671869,
    "tz": "America/New_York"
   },
   "RSW": {
    "name": "Southwest Florida International Airport",
    "lat": 26.536164,
    "lon": -81.755155,
    "tz": "America/New_York"
   },
   "SFO": {
    "name": "San Francisco International Airport",
    "lat": 37.618806,
    "lon": -122.375417,
    "tz": "America/Los_Angeles"
   }
  },
  "tails": [
   {
    "tail": "N179JB",
    "family": "E190",
    "seats": 100,
    "pos": "JFK",
    "ready": 907,
    "end_req": "CHS",
    "actual_end": "CHS"
   },
   {
    "tail": "N190JB",
    "family": "E190",
    "seats": 100,
    "pos": "JFK",
    "ready": 599,
    "end_req": "ROC",
    "actual_end": "ROC"
   },
   {
    "tail": "N192JB",
    "family": "E190",
    "seats": 100,
    "pos": "LGA",
    "ready": 0,
    "end_req": "BOS",
    "actual_end": "BOS"
   },
   {
    "tail": "N198JB",
    "family": "E190",
    "seats": 100,
    "pos": "DCA",
    "ready": 0,
    "end_req": "JFK",
    "actual_end": "DCA"
   },
   {
    "tail": "N2016J",
    "family": "A32X",
    "seats": 200,
    "pos": "RSW",
    "ready": 865,
    "end_req": "JFK",
    "actual_end": "JFK"
   },
   {
    "tail": "N2039J",
    "family": "A32X",
    "seats": 200,
    "pos": "IAH",
    "ready": 846,
    "end_req": "JFK",
    "actual_end": "JFK"
   },
   {
    "tail": "N229JB",
    "family": "E190",
    "seats": 100,
    "pos": "ACK",
    "ready": 0,
    "end_req": "ATL",
    "actual_end": "ACK"
   },
   {
    "tail": "N249JB",
    "family": "E190",
    "seats": 100,
    "pos": "BOS",
    "ready": 892,
    "end_req": "PBI",
    "actual_end": "PBI"
   },
   {
    "tail": "N267JB",
    "family": "E190",
    "seats": 100,
    "pos": "JFK",
    "ready": 848,
    "end_req": "BOS",
    "actual_end": "BOS"
   },
   {
    "tail": "N304JB",
    "family": "E190",
    "seats": 100,
    "pos": "BOS",
    "ready": 825,
    "end_req": "BOS",
    "actual_end": "BOS"
   },
   {
    "tail": "N337JB",
    "family": "E190",
    "seats": 100,
    "pos": "MCO",
    "ready": 961,
    "end_req": "MCO",
    "actual_end": "MCO"
   },
   {
    "tail": "N763JB",
    "family": "A32X",
    "seats": 162,
    "pos": "FLL",
    "ready": 0,
    "end_req": "JFK",
    "actual_end": "JFK"
   },
   {
    "tail": "N958JB",
    "family": "A32X",
    "seats": 200,
    "pos": "JFK",
    "ready": 0,
    "end_req": "JFK",
    "actual_end": "JFK"
   },
   {
    "tail": "N968JT",
    "family": "A32X",
    "seats": 159,
    "pos": "JFK",
    "ready": 1101,
    "end_req": "JFK",
    "actual_end": "JFK"
   },
   {
    "tail": "N986JB",
    "family": "A32X",
    "seats": 159,
    "pos": "LAS",
    "ready": 815,
    "end_req": "JFK",
    "actual_end": "JFK"
   }
  ]
 },
 "model": "follower",
 "model_label": "Reference follower (MIP re-solved each watch)",
 "run": "fixture-small",
 "reward": 0.588,
 "cost": {
  "pax_delay": 1269275,
  "cancel": 1041293,
  "ferry": 148119,
  "total": 2458687
 },
 "reference": {
  "floor": 1851301,
  "hindsight": 2285185,
  "anchor": 2285185,
  "follower": 2458687,
  "blind": 2480542,
  "naive": 2892752,
  "airline": 4789858,
  "gap_pct": 7.59,
  "qualifies": true,
  "reward_follower": 0.588,
  "reward_blind": 0.5542,
  "reward_naive": 0.2635,
  "reward_airline": 0.2
 },
 "schedule": [
  {
   "id": 3,
   "flight": "B6 186",
   "orig": "JFK",
   "dest": "ROC",
   "sched_dep": 630,
   "sched_arr": 718,
   "family": "E190",
   "pax": 85,
   "tail": "N190JB",
   "airline": {
    "cancelled": false,
    "dep": 1021,
    "arr": 1195,
    "cancel_code": ""
   }
  },
  {
   "id": 11,
   "flight": "B6 432",
   "orig": "LGA",
   "dest": "BOS",
   "sched_dep": 795,
   "sched_arr": 875,
   "family": "E190",
   "pax": 85,
   "tail": "N192JB",
   "airline": {
    "cancelled": false,
    "dep": 1190,
    "arr": 1296,
    "cancel_code": ""
   }
  },
  {
   "id": 14,
   "flight": "B6 82",
   "orig": "IAH",
   "dest": "JFK",
   "sched_dep": 802,
   "sched_arr": 1026,
   "family": "A32X",
   "pax": 170,
   "tail": "N2039J",
   "airline": {
    "cancelled": false,
    "dep": 881,
    "arr": 1086,
    "cancel_code": ""
   }
  },
  {
   "id": 15,
   "flight": "B6 1618",
   "orig": "JFK",
   "dest": "BOS",
   "sched_dep": 814,
   "sched_arr": 891,
   "family": "E190",
   "pax": 85,
   "tail": "N179JB",
   "airline": {
    "cancelled": true,
    "dep": null,
    "arr": null,
    "cancel_code": "C"
   }
  },
  {
   "id": 21,
   "flight": "B6 883",
   "orig": "JFK",
   "dest": "MCO",
   "sched_dep": 840,
   "sched_arr": 1024,
   "family": "E190",
   "pax": 85,
   "tail": "N192JB",
   "airline": {
    "cancelled": true,
    "dep": null,
    "arr": null,
    "cancel_code": "C"
   }
  },
  {
   "id": 22,
   "flight": "B6 130",
   "orig": "RSW",
   "dest": "JFK",
   "sched_dep": 857,
   "sched_arr": 1029,
   "family": "A32X",
   "pax": 170,
   "tail": "N2016J",
   "airline": {
    "cancelled": false,
    "dep": 885,
    "arr": 1077,
    "cancel_code": ""
   }
  },
  {
   "id": 29,
   "flight": "B6 1964",
   "orig": "JFK",
   "dest": "HYA",
   "sched_dep": 896,
   "sched_arr": 976,
   "family": "E190",
   "pax": 85,
   "tail": "N190JB",
   "airline": {
    "cancelled": true,
    "dep": null,
    "arr": null,
    "cancel_code": "C"
   }
  },
  {
   "id": 39,
   "flight": "B6 2473",
   "orig": "JFK",
   "dest": "CHS",
   "sched_dep": 935,
   "sched_arr": 1081,
   "family": "E190",
   "pax": 85,
   "tail": "N179JB",
   "airline": {
    "cancelled": false,
    "dep": 1027,
    "arr": 1207,
    "cancel_code": ""
   }
  },
  {
   "id": 45,
   "flight": "B6 731",
   "orig": "BOS",
   "dest": "LGA",
   "sched_dep": 960,
   "sched_arr": 1049,
   "family": "E190",
   "pax": 85,
   "tail": "N192JB",
   "airline": {
    "cancelled": true,
    "dep": null,
    "arr": null,
    "cancel_code": "C"
   }
  },
  {
   "id": 50,
   "flight": "B6 383",
   "orig": "JFK",
   "dest": "MCO",
   "sched_dep": 1003,
   "sched_arr": 1195,
   "family": "A32X",
   "pax": 170,
   "tail": "N2016J",
   "airline": {
    "cancelled": false,
    "dep": 1182,
    "arr": 1370,
    "cancel_code": ""
   }
  },
  {
   "id": 52,
   "flight": "B6 1963",
   "orig": "HYA",
   "dest": "JFK",
   "sched_dep": 1011,
   "sched_arr": 1080,
   "family": "E190",
   "pax": 85,
   "tail": "N190JB",
   "airline": {
    "cancelled": true,
    "dep": null,
    "arr": null,
    "cancel_code": "C"
   }
  },
  {
   "id": 63,
   "flight": "B6 1673",
   "orig": "JFK",
   "dest": "BNA",
   "sched_dep": 1071,
   "sched_arr": 1243,
   "family": "E190",
   "pax": 85,
   "tail": "N198JB",
   "airline": {
    "cancelled": true,
    "dep": null,
    "arr": null,
    "cancel_code": "B"
   }
  },
  {
   "id": 66,
   "flight": "B6 884",
   "orig": "MCO",
   "dest": "JFK",
   "sched_dep": 1090,
   "sched_arr": 1260,
   "family": "E190",
   "pax": 85,
   "tail": "N192JB",
   "airline": {
    "cancelled": true,
    "dep": null,
    "arr": null,
    "cancel_code": "C"
   }
  },
  {
   "id": 67,
   "flight": "B6 1733",
   "orig": "DCA",
   "dest": "PBI",
   "sched_dep": 1090,
   "sched_arr": 1238,
   "family": "E190",
   "pax": 85,
   "tail": "N249JB",
   "airline": {
    "cancelled": false,
    "dep": 1086,
    "arr": 1229,
    "cancel_code": ""
   }
  },
  {
   "id": 69,
   "flight": "B6 1232",
   "orig": "LGA",
   "dest": "BOS",
   "sched_dep": 1095,
   "sched_arr": 1178,
   "family": "E190",
   "pax": 85,
   "tail": "N304JB",
   "airline": {
    "cancelled": true,
    "dep": null,
    "arr": null,
    "cancel_code": "C"
   }
  },
  {
   "id": 73,
   "flight": "B6 1185",
   "orig": "JFK",
   "dest": "RDU",
   "sched_dep": 1115,
   "sched_arr": 1238,
   "family": "E190",
   "pax": 85,
   "tail": "N190JB",
   "airline": {
    "cancelled": true,
    "dep": null,
    "arr": null,